"tweet_id","in_reply_to_status_id","in_reply_to_user_id","retweeted_status_id","retweeted_status_user_id","timestamp","source","text","expanded_urls"
"303609212","","","","","2007-09-30 21:15:09 +0000","<a href=""http://twitter.com/devices"" rel=""nofollow"">txt</a>","Um... why isn't my thermostat working? It's cold!"
"299857522","299851952","784078","","","2007-09-28 21:38:02 +0000","<a href=""http://twitter.com/devices"" rel=""nofollow"">txt</a>","@alicetiara Congratulations! Well done!"
"299551562","","","","","2007-09-28 18:40:05 +0000","<a href=""http://twitter.com/devices"" rel=""nofollow"">txt</a>","Waiting for a lunch date that doesn't seem to be coming..."
"297877402","","","","","2007-09-28 01:32:28 +0000","<a href=""http://twitter.com/devices"" rel=""nofollow"">txt</a>","Backing up my computers for the first time in my life!"
"287493462","","","","","2007-09-23 08:01:41 +0000","<a href=""http://twitter.com/devices"" rel=""nofollow"">txt</a>","Homemade rose!"
"275481782","","","","","2007-09-18 00:12:57 +0000","web","I'm getting married!  http://bustermcleod.livejournal.com/141803.html"
"261710622","","","","","2007-09-11 17:42:55 +0000","<a href=""http://twitter.com/devices"" rel=""nofollow"">txt</a>","I want to be as famous as Persil Automatic - Posh Spice"
"259032632","","","","","2007-09-10 15:08:11 +0000","web","I've been Buster Butterfield McLeod for one year."
